{
  "$schema": "https://json-schema.org/draft/2020-12/schema",
  "$id": "fauna",
  "title": "Fauna",
  "type": "object",
  "required": ["id", "world_id", "name", "description", "region_ids", "creature_type", "level", "hostile"],
  "additionalProperties": false,
  "properties": {
    "id":          { "type": "string", "minLength": 1 },
    "world_id":    { "type": "string", "minLength": 1 },
    "name":        { "type": "string", "minLength": 1 },
    "description": { "type": "string" },
    "region_ids": {
      "type": "array",
      "items": { "type": "string", "minLength": 1 },
      "minItems": 1,
      "uniqueItems": true
    },
    "creature_type": { "type": "string", "minLength": 1 },
    "level":   { "type": "integer", "minimum": 1, "maximum": 20 },
    "hostile": { "type": "boolean" },
    "gathering_yields": {
      "type": "array",
      "items": { "type": "string", "minLength": 1 },
      "uniqueItems": true
    }
  }
}
